{
  "protocolVersion": "0",
  "requestId": "transform-set-1",
  "operation": "transform.set",
  "arguments": {
    "globalObjectId": "GlobalObjectId_V1-2-00000000000000000000000000000000-1-0",
    "localPosition": { "x": 1.25, "y": -2.5, "z": 3.75 },
    "localEulerAngles": { "x": 15, "y": 30, "z": 45 },
    "localScale": { "x": 1.5, "y": 0.75, "z": 2 },
    "mutationId": "transform-example-1",
    "expectedStateEpoch": "example-editor-session",
    "expectedStateRevision": 12
  },
  "risk": "write",
  "deadlineUnixMs": 1787461000000
}
