{
  "protocolVersion": "0",
  "requestId": "create-game-object-fixture-001",
  "operation": "scene.create_game_object",
  "arguments": {
    "name": "Fixture Object",
    "idempotencyKey": "fixture-create-0001"
  },
  "risk": "write",
  "route": {
    "editorId": "fixture-editor",
    "connectionGeneration": 42
  },
  "deadlineUnixMs": 4102444800000
}
