{
  "protocolVersion": "0",
  "requestId": "fixture-test-run-playmode-get",
  "operation": "test.run.get",
  "arguments": {
    "mutationId": "fixture-test-run-playmode-1"
  },
  "risk": "read",
  "route": {
    "editorId": "fixture-editor",
    "connectionGeneration": 2
  },
  "deadlineUnixMs": 4102444800000
}
